<?xml version="1.0"?>
<xs:schema version="1.0"
           xmlns:xs="http://www.w3.org/2001/XMLSchema"
           elementFormDefault="qualified">

    <xs:element name="personne">
        <xs:complexType>
            <xs:sequence>
                <xs:element  name="id" type="xs:integer"/>                
                <xs:element  name="nom" >
                    <xs:simpleType>
                        <xs:restriction base="xs:string">
                            <xs:minLength value="1"/>                            
                        </xs:restriction> 
                    </xs:simpleType>
                </xs:element>
                <xs:element name="telephones">
                    <xs:complexType>
                        <xs:sequence>
                            <xs:element ref="telephone" maxOccurs="unbounded"/>
                        </xs:sequence>
                    </xs:complexType>
                </xs:element>                    
            </xs:sequence>
        </xs:complexType>
    </xs:element>
    <xs:element name="telephone">
        <xs:complexType>
            <xs:sequence>
                <xs:element  name="numero" type="xs:string"/>    
            </xs:sequence>
        </xs:complexType>
    </xs:element>

</xs:schema>
